{
    "name": "Equipment hire",
    "summary": "A single bonded rental, resolved in the studio's own token — no card processor, no float.",
    "description": "A renter books a piece of equipment — a camera kit, an audio rig, a tool — directly from its owner. Both sides lock a bond worth more than the trade, so returning it and paying for it are each party's most profitable move — no card network, no security deposit held by a platform. The composition pins one ERC-20 as the whole assembly's denomination, set once by the studio that designed it: checkout writes that pin straight into the agreement, so no token picker ever appears and every signer sees the same denomination the assembly was built in.",
    "assemblyClauses": {
        "figaro-utility-token": {
            "currency": "0x0000000000000000000000000000000000000000"
        }
    },
    "agreements": [
        {
            "id": "agreement-0",
            "agreement": "counter-sale"
        }
    ]
}
