{
    "name": "Data stream",
    "summary": "A period of access to someone's live data — licensed, delivered privately, provable point by point.",
    "description": "A buyer buys a window of access to the data another member's trade produces — a drone's flight telemetry, a sensor's readings, a merchant's on-chain data. The license terms are co-signed: what is licensed, what it may be used for, whether it may be passed on. Access arrives over the encrypted hand-off as a credential or a snapshot, and every entry it unlocks is self-authenticating — a leaf provable against the resolved agreement that produced it, so the buyer never has to trust the seller's word about provenance. The access window is a committed term; renewing is a new bonded process, which is what keeps both sides honest: a seller who degrades the stream loses the renewal, and gas is paid once per window, not per data point.",
    "agreements": [
        {
            "id": "agreement-0",
            "agreement": "data-stream-access"
        }
    ]
}
